CN-114121400-A,Simplified permanent magnet star simulator device ,中国科学院合肥物质科学研究院,"徐国盛, 陆志远, 陈德鸿, 陈良, 张翔宇, 叶民友, 颜宁, 伍兴权",2021-11-19,2021-11-19,2022-03-01,,https://patents.google.com/patent/CN114121400A/en,https://patentimages.storage.googleapis.com/09/40/63/190ab43c27722e/HDA0003363094190000011.png
CN-114038582-A,Measuring target holder for supporting and assembling of parts in vacuum chamber of future fusion reactor and using method thereof ,"中国科学院合肥物质科学研究院, 合肥聚能电物理高技术开发有限公司, 淮南新能源研究中心","刘志宏, 吉海标, 唐群, 王锐, 马建国, 范小松, 李波, 周能涛, 吴杰峰, 刘振飞",2021-11-19,2021-11-19,2022-02-11,,https://patents.google.com/patent/CN114038582A/en,https://patentimages.storage.googleapis.com/86/fb/13/38dfac62dc9e2e/HDA0003365058080000011.png
US-2023326616-A1,Breeder blanket ,Tokamak Energy Ltd,"Thomas Davis, Simon Middleburgh, Jack Astbury, Gurdeep Kamal",2020-11-19,2021-11-19,2023-10-12,,https://patents.google.com/patent/US20230326616A1/en,https://patentimages.storage.googleapis.com/87/68/9c/731001db57b1d2/US20230326616A1-20231012-D00000.png
WO-2022106609-A1,Breeder blanket ,Tokamak Energy Ltd,"Thomas Davis, Simon MIDDLEBURGH, Jack ASTBURY, Gurdeep KAMAL",2020-11-19,2021-11-19,2022-05-27,,https://patents.google.com/patent/WO2022106609A1/en,
AU-2021380945-A1,Breeder blanket ,Tokamak Energy Ltd,"Jack ASTBURY, Thomas Davis, Gurdeep KAMAL, Simon MIDDLEBURGH",2020-11-19,2021-11-19,2023-06-15,,https://patents.google.com/patent/AU2021380945A1/en,
EP-4248462-A1,Breeder blanket ,Tokamak Energy Ltd,"Thomas Davis, Simon MIDDLEBURGH, Jack ASTBURY, Gurdeep KAMAL",2020-11-19,2021-11-19,2023-09-27,,https://patents.google.com/patent/EP4248462A1/en,
CA-3199186-A1,Breeder blanket ,"Thomas Davis, Simon MIDDLEBURGH, Jack ASTBURY, Tokamak Energy Ltd, Gurdeep KAMAL","Thomas Davis, Simon MIDDLEBURGH, Jack ASTBURY, Gurdeep KAMAL",2020-11-19,2021-11-19,2022-05-27,,https://patents.google.com/patent/CA3199186A1/en,
CN-114121400-B,Simplified permanent magnet star simulator device ,中国科学院合肥物质科学研究院,"徐国盛, 陆志远, 陈德鸿, 陈良, 张翔宇, 叶民友, 颜宁, 伍兴权",2021-11-19,2021-11-19,2023-07-14,2023-07-14,https://patents.google.com/patent/CN114121400B/en,https://patentimages.storage.googleapis.com/20/cb/13/04354fb3d02f71/HDA0003363094190000011.png
KR-20230104281-A,breeder blanket ,토카막 에너지 리미티드,"토마스 데이비스, 사이먼 미들버그, 잭 애스트버리, 구르딥 카말",2020-11-19,2021-11-19,2023-07-07,,https://patents.google.com/patent/KR20230104281A/en,https://patentimages.storage.googleapis.com/c4/db/f9/433ca8b4cdb3a4/pct00005.png
CN-116457895-A,Proliferation cladding ,托卡马克能量有限公司,"托马斯·戴维斯, 西蒙·米德尔堡, 杰克·阿斯特伯里, 古尔迪普·卡尔马",2020-11-19,2021-11-19,2023-07-18,,https://patents.google.com/patent/CN116457895A/en,
JP-7432800-B2,proliferation blanket ,トカマク エナジー リミテッド,"トーマス デービス、, サイモン ミドルバーグ、, ジャック アストベリー、, ガーディープ カマル、",2020-11-19,2021-11-19,2024-02-16,2024-02-16,https://patents.google.com/patent/JP7432800B2/en,https://patentimages.storage.googleapis.com/f0/4c/79/4b218647909fa1/0007432800000003.png
JP-2023545866-A,proliferation blanket ,トカマク エナジー リミテッド,"トーマス デービス、, サイモン ミドルバーグ、, ジャック アストベリー、, ガーディープ カマル、",2020-11-19,2021-11-19,2023-10-31,,https://patents.google.com/patent/JP2023545866A/en,https://patentimages.storage.googleapis.com/50/0a/a9/84602996f4ebd5/2023545866000004.png
CN-114093528-B,Laser poly black cavity wall structure and black cavity ,北京应用物理与计算数学研究所,"蓝可, 陈耀桦, 曹辉, 李波, 樊元成, 杨蕤生, 许晶",2021-11-22,2021-11-22,2023-09-26,2023-09-26,https://patents.google.com/patent/CN114093528B/en,
CN-114093528-A,Laser fusion black cavity wall structure and black cavity ,北京应用物理与计算数学研究所,"蓝可, 陈耀桦, 曹辉, 李波, 樊元成, 杨蕤生, 许晶",2021-11-22,2021-11-22,2022-02-25,,https://patents.google.com/patent/CN114093528A/en,https://patentimages.storage.googleapis.com/cf/5c/b4/9e91d4d25aed55/HDA0003367286000000011.png
WO-2022205950-A1,Assembling method for silicon-oriented cooling arm ,苏州大学,"陈涛, 倪克健, 黄志颖, 田玉祥, 田显东, 吴文荣, 戴亚平, 孙立宁",2021-03-31,2021-11-23,2022-10-06,,https://patents.google.com/patent/WO2022205950A1/en,https://patentimages.storage.googleapis.com/db/6c/7f/7484cb4e9104c1/PCTCN2021132345-appb-300001.png
US-2023044875-A1,An assembly method for a silicon cooling arm ,Soochow University,"Tao Chen, Kejian NI, Zhiying HUANG, Yuxiang TIAN, Xiandong TIAN, Wenrong WU, Yaping Dai, Lining Sun",2021-03-31,2021-11-23,2023-02-09,,https://patents.google.com/patent/US20230044875A1/en,https://patentimages.storage.googleapis.com/69/f7/9b/6cc5ef7ab95f0e/US20230044875A1-20230209-D00000.png
JP-2023552979-A,enclosed pebble ,ユナイテッド キングダム アトミック エナジー オーソリティー,"ホセ カルボ プラザ、フランシスコ, フラデラ フェルナンデス、ホルヘ, サダバ シプリアイン、セルジオ, ハ、サミュエル",2020-11-26,2021-11-25,2023-12-20,,https://patents.google.com/patent/JP2023552979A/en,https://patentimages.storage.googleapis.com/4e/13/a7/146e4cafe6a5a2/2023552979000002.png
WO-2022188461-A1,Closed v-shaped acute angle structure of diverter first wall ,中国科学院合肥物质科学研究院,"宋云涛, 冯思庆, 彭学兵, 刘鹏, 卯鑫, 钱新元, 宋伟",2021-03-09,2021-11-25,2022-09-15,,https://patents.google.com/patent/WO2022188461A1/en,https://patentimages.storage.googleapis.com/22/2b/70/c78cd27687ad96/PCTCN2021132947-appb-300001.png
WO-2022130075-A1,Method for automatically adjusting an ion cyclotron resonance heating system of a thermonuclear reactor ,Excem,"Frederic Broyde, Evelyne Clavelier",2020-12-14,2021-11-25,2022-06-23,,https://patents.google.com/patent/WO2022130075A1/en,
KR-20230144003-A,Encapsulated Pebble ,유나이티드킹덤아토믹에너지오쏘리티,"프란치스코 호세 칼보 플라차, 요르게 프라데라 페르난데즈, 세르지오 사다바 씨프리아인, 새뮤엘 하",2020-11-26,2021-11-25,2023-10-13,,https://patents.google.com/patent/KR20230144003A/en,
WO-2022112441-A1,Encapsulated pebble ,United Kingdom Atomic Energy Authority,"Francisco Jose Calvo PLAZA, Jorge Fradera FERNANDEZ, Sergio Sadaba CIPRIAIN, Samuel HA",2020-11-26,2021-11-25,2022-06-02,,https://patents.google.com/patent/WO2022112441A1/en,
CN-114121306-A,Verification device for feasibility of thermoelectric generation waste heat utilization of heat pipe of lower divertor of Tokamak ,西安交通大学,"郭凯伦, 张嘉睿, 田智星, 王成龙, 张大林, 田文喜, 秋穗正, 苏光辉",2021-11-25,2021-11-25,2022-03-01,,https://patents.google.com/patent/CN114121306A/en,https://patentimages.storage.googleapis.com/52/ad/8e/1b8587e18134c1/HDA0003375628060000011.png
CN-116848590-A,Packaging ball ,英国原子能管理局,"弗朗西斯科·约瑟·卡尔沃·普拉扎, 豪尔赫·弗拉德拉·费尔南德斯, 塞尔吉奥·萨达巴·奇普里安, 萨缪尔·哈",2020-11-26,2021-11-25,2023-10-03,,https://patents.google.com/patent/CN116848590A/en,
CA-3199963-A1,Encapsulated pebble ,"United Kingdom Atomic Energy Authority, Francisco Jose Calvo PLAZA, Jorge Fradera FERNANDEZ, Sergio Sadaba CIPRIAIN, Samuel HA","Francisco Jose Calvo PLAZA, Jorge Fradera FERNANDEZ, Sergio Sadaba CIPRIAIN, Samuel HA",2020-11-26,2021-11-25,2022-06-02,,https://patents.google.com/patent/CA3199963A1/en,
EP-4086921-A1,Closed v-shaped acute angle structure of diverter first wall ,Hefei Institutes of Physical Science of Chinese Academy of Science,"Yuntao Song, Siqing FENG, Xuebing PENG, Peng Liu, Xin Mao, Xinyuan Qian, Wei Song",2021-03-09,2021-11-25,2022-11-09,,https://patents.google.com/patent/EP4086921A1/en,https://patentimages.storage.googleapis.com/2f/37/ef/3f3f0a20952349/imgf0001.png
CN-114141391-A,Tokamak lower divertor heat pipe thermoelectric generation waste heat utilization system and working method ,西安交通大学,"郭凯伦, 张嘉睿, 田智星, 王成龙, 张大林, 田文喜, 秋穗正, 苏光辉",2021-11-25,2021-11-25,2022-03-04,,https://patents.google.com/patent/CN114141391A/en,https://patentimages.storage.googleapis.com/e9/bb/33/42e04b55956d45/HDA0003374946770000011.png
EP-4086921-A4,Closed v-shaped acute angle structure of diverter first wall ,Hefei Institutes of Physical Science of Chinese Academy of Science,"Yuntao Song, Xuebing PENG, Peng Liu, Siqing FENG, Xin Mao, Xinyuan Qian, Wei Song",2021-03-09,2021-11-25,2023-10-18,,https://patents.google.com/patent/EP4086921A4/en,
RU-210128-U1,BLANKET FOR ISOTOPE TRANSMUTATION ,"Федеральное государственное бюджетное учреждение ""Национальный исследовательский центр ""Курчатовский институт""","Борис Васильевич Кутеев, Александр Юрьевич Пашков, Юрий Сергеевич Шпанский",2021-11-29,2021-11-29,2022-03-29,2022-03-29,https://patents.google.com/patent/RU210128U1/en,https://patentimages.storage.googleapis.com/7e/7b/98/30341693dd1517/00000016.png
CN-114150206-A,Tungsten-based columnar crystal high-entropy alloy surface-to-plasma material and preparation method thereof ,北京航空航天大学,"袁悦, 孙钰涵, 王诗维, 程龙, 吕广宏",2021-11-29,2021-11-29,2022-03-08,,https://patents.google.com/patent/CN114150206A/en,
CN-114150206-B,Tungsten-based columnar crystal high-entropy alloy plasma facing material and preparation method thereof ,北京航空航天大学,"袁悦, 孙钰涵, 王诗维, 程龙, 吕广宏",2021-11-29,2021-11-29,2023-11-21,2023-11-21,https://patents.google.com/patent/CN114150206B/en,
EP-4260343-A2,Design of a composite hydride-metal to accommodate hydride decomposition ,Tokamak Energy Ltd,"Thomas Davis, Simon MIDDLEBURGH",2020-12-16,2021-11-30,2023-10-18,,https://patents.google.com/patent/EP4260343A2/en,
CA-3202417-A1,On the design of a composite hydride-metal to accommodate hydride decomposition ,"Thomas Davis, Tokamak Energy Ltd, Simon MIDDLEBURGH","Thomas Davis, Simon MIDDLEBURGH",2020-12-16,2021-11-30,2022-06-23,,https://patents.google.com/patent/CA3202417A1/en,
CN-114141392-A,"Laser fusion ignition target with three-cone structure, assembly device and assembly method ",上海交通大学,"刘景全, 徐梦飞, 林祖德, 王晓林, 刘武",2021-11-30,2021-11-30,2022-03-04,,https://patents.google.com/patent/CN114141392A/en,https://patentimages.storage.googleapis.com/95/b9/83/d9f2c88252184e/HDA0003382495440000011.png
US-2024055145-A1,On the design of a composite hydride-metal to accommodate hydride decomposition ,Tokamak Energy Ltd.,"Thomas Davis, Simon Middleburgh",2020-12-16,2021-11-30,2024-02-15,,https://patents.google.com/patent/US20240055145A1/en,https://patentimages.storage.googleapis.com/65/c7/f8/2cc51521dce3e8/US20240055145A1-20240215-D00000.png
WO-2022128456-A2,On the design of a composite hydride-metal to accommodate hydride decomposition ,Tokamak Energy Ltd,"Thomas Davis, Simon MIDDLEBURGH",2020-12-16,2021-11-30,2022-06-23,,https://patents.google.com/patent/WO2022128456A2/en,
JP-2023552911-A,"Use of metal hydride metal composites in neutron shields, systems including neutron shields, and methods of providing neutron shields ",トカマク エナジー リミテッド,"トーマス デービス、, サイモン ミドルバーグ、",2020-12-16,2021-11-30,2023-12-19,,https://patents.google.com/patent/JP2023552911A/en,https://patentimages.storage.googleapis.com/a1/a0/d5/bfb5c45fd8ab35/2023552911000005.png
AU-2021403382-A1,Design of a composite hydride-metal to accommodate hydride decomposition ,Tokamak Energy Ltd,"Thomas Davis, Simon MIDDLEBURGH",2020-12-16,2021-11-30,2023-07-27,,https://patents.google.com/patent/AU2021403382A1/en,
CN-116964684-A,Design of composite hydride metals suitable for hydride decomposition ,托卡马克能量有限公司,"托马斯·戴维斯, 西蒙·米德尔堡",2020-12-16,2021-11-30,2023-10-27,,https://patents.google.com/patent/CN116964684A/en,
WO-2022128456-A3,Design of a composite hydride-metal to accommodate hydride decomposition ,Tokamak Energy Ltd,"Thomas Davis, Simon MIDDLEBURGH",2020-12-16,2021-11-30,2022-07-28,,https://patents.google.com/patent/WO2022128456A3/en,
KR-20230116065-A,On the design of complex hydride-metals to accommodate hydride decomposition ,토카막 에너지 리미티드,"토마스 데이비스, 사이먼 미들버그",2020-12-16,2021-11-30,2023-08-03,,https://patents.google.com/patent/KR20230116065A/en,
JP-2024500320-A,In situ metal deposition in tokamaks ,トカマク エナジー リミテッド,"ロブ バンバー、, マイク ジャクソン、",2020-12-08,2021-12-01,2024-01-09,,https://patents.google.com/patent/JP2024500320A/en,https://patentimages.storage.googleapis.com/72/90/d6/249188eed04044/2024500320000002.png
EP-4200876-A1,In-situ metal deposition in a tokamak ,Tokamak Energy Ltd,"Rob BAMBER, Mike Jackson",2020-12-08,2021-12-01,2023-06-28,,https://patents.google.com/patent/EP4200876A1/en,
AU-2021394563-A1,In-situ metal deposition in a tokamak ,Tokamak Energy Ltd,"Rob BAMBER, Mike Jackson",2020-12-08,2021-12-01,2023-06-29,,https://patents.google.com/patent/AU2021394563A1/en,
KR-20230119164-A,In situ metal deposition in tokamak ,토카막 에너지 리미티드,"롭 밤버, 마이크 잭슨",2020-12-08,2021-12-01,2023-08-16,,https://patents.google.com/patent/KR20230119164A/en,
CN-116569280-A,In situ metal deposition in tokamak ,托卡马克能量有限公司,"瑞博·班贝, 迈克·杰克逊",2020-12-08,2021-12-01,2023-08-08,,https://patents.google.com/patent/CN116569280A/en,
CA-3201246-A1,In-situ metal deposition in a tokamak ,"Rob BAMBER, Tokamak Energy Ltd, Mike Jackson","Rob BAMBER, Mike Jackson",2020-12-08,2021-12-01,2022-06-16,,https://patents.google.com/patent/CA3201246A1/en,
WO-2022122501-A1,In-situ metal deposition in a tokamak ,Tokamak Energy Ltd,"Rob BAMBER, Mike Jackson",2020-12-08,2021-12-01,2022-06-16,,https://patents.google.com/patent/WO2022122501A1/en,
CN-116013553-A,Inertial electrostatic confinement fusion device for electron injection neutralization ,李粉花,李金海,2021-10-22,2021-12-03,2023-04-25,,https://patents.google.com/patent/CN116013553A/en,https://patentimages.storage.googleapis.com/cf/70/d5/5f6f3bee289f97/HSA0000259514630000011.png
CN-114203313-A,Fusion reactor divertor tube-penetrating type assembly capable of effectively relieving heat concentration ,"中国科学院合肥物质科学研究院, 北京安泰中科金属材料有限公司","李强, 彭吴擎亮, 秦思贵, 史英利, 罗广南, 刘国辉, 陈镇, 谢春意, 王万景",2021-12-03,2021-12-03,2022-03-18,,https://patents.google.com/patent/CN114203313A/en,https://patentimages.storage.googleapis.com/e6/5d/5c/10ada2a1c88e57/HDA0003391304950000011.png
CN-114155980-A,Infiltrating spherical shell for low-temperature freezing target and preparation method thereof ,上海交通大学,"刘景全, 朱先涛, 林祖德, 王晓林, 刘武",2021-12-06,2021-12-06,2022-03-08,,https://patents.google.com/patent/CN114155980A/en,https://patentimages.storage.googleapis.com/5b/a9/7d/7b8bc1f8c8bdc0/HDA0003393647020000011.png
CN-115188497-A,Adjustable insulation assembly for fusion device discharge cleaning electrode ,核工业西南物理研究院,"曹诚志, 胡毅, 黄向玫, 崔成和, 高霄雁, 曹曾",2021-12-09,2021-12-09,2022-10-14,,https://patents.google.com/patent/CN115188497A/en,https://patentimages.storage.googleapis.com/9a/86/d6/3f8dc0817be0cc/RE-HDA0003528487680000011.png
GB-2617747-A,Plasma injection and confinement systems and methods ,Fuse Energy Tech Corp,"Golingo Raymond, Btaiche Jean-Christoph, Harris Paul, Choudhury Ayan, Seifollahi Moghadam Zahra, Tochon Pierre",2020-12-10,2021-12-10,2023-10-18,,https://patents.google.com/patent/GB2617747A/en,
WO-2022125912-A1,Plasma injection and confinement systems and methods ,Fuse Energy Technologies Corp.,"Raymond Golingo, Jean-christoph BTAICHE, Paul Harris, Ayan CHOUDHURY, Zahra SEIFOLLAHI MOGHADAM, Pierre TOCHON",2020-12-10,2021-12-10,2022-06-16,,https://patents.google.com/patent/WO2022125912A1/en,
CA-3201923-A1,Plasma injection and confinement systems and methods ,"Fuse Energy Technologies Corp., Jean-christoph BTAICHE, Ayan CHOUDHURY, Raymond Golingo, Paul Harris, Zahra SEIFOLLAHI MOGHADAM, Pierre TOCHON","Jean-christoph BTAICHE, Ayan CHOUDHURY, Raymond Golingo, Paul Harris, Zahra SEIFOLLAHI MOGHADAM, Pierre TOCHON",2020-12-10,2021-12-10,2022-06-16,,https://patents.google.com/patent/CA3201923A1/en,
WO-2022132791-A1,Laser-based sub-doppler circular dichroism spectroscopy in frc device ,"Tae Technologies, Inc.",Marcel NATIONS,2020-12-14,2021-12-14,2022-06-23,,https://patents.google.com/patent/WO2022132791A1/en,
US-2024062919-A1,Rotating core plasma compression system ,General Fusion Inc.,"Joerg Zimmermann, Robert BOUCHAL, II William Randolph SMITH",,2021-12-16,2024-02-22,,https://patents.google.com/patent/US20240062919A1/en,https://patentimages.storage.googleapis.com/59/0a/d4/fbbeafa38ba675/US20240062919A1-20240222-D00000.png
EP-4252255-A1,Rotating core plasma compression system ,General Fusion Inc.,"Joerg Zimmermann, Robert BOUCHAL, W. Randolph SMITH",2021-01-22,2021-12-16,2023-10-04,,https://patents.google.com/patent/EP4252255A1/en,
US-2024062918-A1,Method and apparatus for controlling plasma compression ,General Fusion Inc.,"Michel Georges Laberge, David Franklin Plant, Raphael SEGAS, II William Randolph SMITH",,2021-12-16,2024-02-22,,https://patents.google.com/patent/US20240062918A1/en,https://patentimages.storage.googleapis.com/a9/a9/eb/46b68d43ba76e7/US20240062918A1-20240222-D00000.png
KR-20230133332-A,Rotating Core Plasma Compression System ,제너럴 퓨전 아이엔씨.,"외르그 짐머만, 로버트 보샬, 더블유. 란돌프 스미스",2021-01-22,2021-12-16,2023-09-19,,https://patents.google.com/patent/KR20230133332A/en,
WO-2022155725-A1,Rotating core plasma compression system ,General Fusion Inc.,"Joerg Zimmermann, Robert BOUCHAL, W. Randolph SMITH",2021-01-22,2021-12-16,2022-07-28,,https://patents.google.com/patent/WO2022155725A1/en,
CN-116711024-A,Rotating core plasma compression system ,通用融合公司,"约尔格·齐默尔曼, 罗伯特·鲍哈尔, W.·兰道夫·史密斯",2021-01-22,2021-12-16,2023-09-05,,https://patents.google.com/patent/CN116711024A/en,
JP-2024504067-A,Rotating core plasma compression system ,ジェネラル フュージョン インコーポレイテッド,"ジマーマン、イェルク, ブシャール、ロバート, スミス、ダブリュー．ランドルフ",2021-01-22,2021-12-16,2024-01-30,,https://patents.google.com/patent/JP2024504067A/en,https://patentimages.storage.googleapis.com/1c/e7/18/19ce46ebb6f548/2024504067000002.png
CA-3204955-A1,Rotating core plasma compression system ,"Joerg Zimmermann, General Fusion Inc., Robert BOUCHAL, W. Randolph SMITH","Joerg Zimmermann, Robert BOUCHAL, W. Randolph SMITH",2021-01-22,2021-12-16,2022-07-28,,https://patents.google.com/patent/CA3204955A1/en,
CA-3204955-C,Rotating core plasma compression system ,"Joerg Zimmermann, General Fusion Inc., Robert BOUCHAL, W. Randolph SMITH","Joerg Zimmermann, Robert BOUCHAL, W. Randolph SMITH",2021-01-22,2021-12-16,2024-01-02,2024-01-02,https://patents.google.com/patent/CA3204955C/en,
CN-114373557-A,Flat target plate for fusion device ultrahigh heat load component and processing method thereof ,中国科学院合肥物质科学研究院,"訾鹏飞, 李磊, 殷磊, 韩乐, 王兆亮, 曹磊, 许铁军, 姚达毛",2021-12-17,2021-12-17,2022-04-19,,https://patents.google.com/patent/CN114373557A/en,https://patentimages.storage.googleapis.com/12/71/e0/ad52b760eed65f/HDA0003418447120000011.png
CN-114360747-B,Tokamak plasma rupture real-time control and mitigation system and method ,核工业西南物理研究院,张轶泼,2021-12-17,2021-12-17,2023-08-15,2023-08-15,https://patents.google.com/patent/CN114360747B/en,
CN-114388148-A,Ultrasonic molecular beam injection pulse time sequence control system and method ,核工业西南物理研究院,"肖国梁, 陈程远, 冯北滨, 钟武律, 殷娇",2021-12-17,2021-12-17,2022-04-22,,https://patents.google.com/patent/CN114388148A/en,https://patentimages.storage.googleapis.com/21/e5/67/cda0d3606f4411/HDA0003418659950000011.png
CN-114388149-B,Pulse generator set discharge synchronous signal processing system ,核工业西南物理研究院,"任青华, 王英翘, 李维斌, 王雅丽, 吴一",2021-12-17,2021-12-17,2023-07-14,2023-07-14,https://patents.google.com/patent/CN114388149B/en,https://patentimages.storage.googleapis.com/64/b6/75/9666f66a28f1bf/HDA0003418658430000011.png
CN-114360747-A,Tokamak plasma breakage real-time control and mitigation system and method ,核工业西南物理研究院,张轶泼,2021-12-17,2021-12-17,2022-04-15,,https://patents.google.com/patent/CN114360747A/en,https://patentimages.storage.googleapis.com/43/4b/ab/30c793f44f9a30/HDA0003417925860000011.png
CN-114388149-A,Pulse generator set discharge synchronization signal processing system ,核工业西南物理研究院,"任青华, 王英翘, 李维斌, 王雅丽, 吴一",2021-12-17,2021-12-17,2022-04-22,,https://patents.google.com/patent/CN114388149A/en,https://patentimages.storage.googleapis.com/0d/69/f6/8534592d325d5e/HDA0003418658430000011.png
CN-114388148-B,Ultrasonic molecular beam injection pulse time sequence control system and method ,核工业西南物理研究院,"肖国梁, 陈程远, 冯北滨, 钟武律, 殷娇",2021-12-17,2021-12-17,2023-08-15,2023-08-15,https://patents.google.com/patent/CN114388148B/en,
CN-114420314-A,First wall structure for fusion reactor high-dose neutron irradiation and megawatt thermal load ,核工业西南物理研究院,"谌继明, 王小勇, 栗再新, 郑鹏飞, 李佳霖, 廖洪彬, 张归航",2021-12-20,2021-12-20,2022-04-29,,https://patents.google.com/patent/CN114420314A/en,https://patentimages.storage.googleapis.com/6f/ba/b2/95265eee91c27f/HDA0003421348460000011.png
KR-20230123997-A,Plasma facing component cooling ,토카막 에너지 리미티드,롭 뱀버,2020-12-21,2021-12-20,2023-08-24,,https://patents.google.com/patent/KR20230123997A/en,
JP-2024500812-A,Cooling of plasma facing components ,トカマク エナジー リミテッド,ロブ バンバー、,2020-12-21,2021-12-20,2024-01-10,,https://patents.google.com/patent/JP2024500812A/en,https://patentimages.storage.googleapis.com/22/77/4a/abf155735076d1/2024500812000002.png
CN-114242270-A,Compound parabolic light-gathering target and preparation process thereof ,上海交通大学,"刘景全, 徐庆达, 林祖德, 王晓林, 刘武",2021-12-20,2021-12-20,2022-03-25,,https://patents.google.com/patent/CN114242270A/en,https://patentimages.storage.googleapis.com/31/4d/07/b0a023564ea7d4/HDA0003419700740000011.png
CA-3202864-A1,Plasma-facing component cooling ,"Rob BAMBER, Tokamak Energy Ltd",Rob BAMBER,2020-12-21,2021-12-20,2022-06-30,,https://patents.google.com/patent/CA3202864A1/en,
CN-116635621-A,Cooling of plasma-facing components ,托卡马克能量有限公司,瑞博·班贝,2020-12-21,2021-12-20,2023-08-22,,https://patents.google.com/patent/CN116635621A/en,
AU-2021405132-A1,Plasma-facing component cooling ,Tokamak Energy Ltd,Rob BAMBER,2020-12-21,2021-12-20,2023-07-06,,https://patents.google.com/patent/AU2021405132A1/en,
WO-2022136324-A1,Plasma-facing component cooling ,Tokamak Energy Ltd,Rob BAMBER,2020-12-21,2021-12-20,2022-06-30,,https://patents.google.com/patent/WO2022136324A1/en,
EP-4264634-A1,Plasma-facing component cooling ,Tokamak Energy Ltd,Rob BAMBER,2020-12-21,2021-12-20,2023-10-25,,https://patents.google.com/patent/EP4264634A1/en,
CN-114415225-A,Nuclear fusion alpha particle loss detector ,核工业西南物理研究院,"张轶泼, 张洁, 占许文",2021-12-20,2021-12-20,2022-04-29,,https://patents.google.com/patent/CN114415225A/en,https://patentimages.storage.googleapis.com/fa/9a/b7/6414e1da02bb7d/HDA0003421350220000011.png
JP-2023554681-A,Improved material for tungsten boride neutron shield ,"トカマク エナジー リミテッド, インペリアル・カレッジ・イノベーションズ・リミテッド","ジャック アストベリー、, コリン ウィンサー、, サミュエル エイ． ハンフリー－ベイカー、, ジェイムズ デイビッドソン、, チャールズ マクファドジーン、",2020-12-22,2021-12-21,2023-12-28,,https://patents.google.com/patent/JP2023554681A/en,https://patentimages.storage.googleapis.com/ab/f7/0f/5b7c3fc8bbc554/2023554681000002.png
CA-3203115-A1,Improved materials for tungsten boride neutron shielding ,"Jack ASTBURY, Tokamak Energy Ltd, Colin WINDSOR, Imperial College Innovations Limited, Samuel A. HUMPHRY-BAKER, James Davidson, Charles MCFADZEAN","Jack ASTBURY, Colin WINDSOR, Samuel A. HUMPHRY-BAKER, James Davidson, Charles MCFADZEAN",2020-12-22,2021-12-21,2022-06-30,,https://patents.google.com/patent/CA3203115A1/en,
EP-4268247-A1,Improved materials for tungsten boride neutron shielding ,"Tokamak Energy Ltd, Imperial College Innovations Limited","Jack ASTBURY, Colin WINDSOR, Samuel A. HUMPHRY-BAKER, James Davidson, Charles MCFADZEAN",2020-12-22,2021-12-21,2023-11-01,,https://patents.google.com/patent/EP4268247A1/en,
